{
  "schema_version": "1.0.0",
  "motion_id": "unitree_walking_v1",
  "source_keyframes_id": "unitree_walking_v1_keyframes",
  "keyframe_timestamps_s": [
    0.0,
    0.56,
    1.1,
    1.66,
    2.22,
    2.76,
    3.32,
    3.88,
    4.42,
    4.98
  ],
  "metadata": {
    "source": "unitree_rl_gym/deploy/pre_train/g1/motion.pt",
    "conversion": "12-DOF policy rollout \u2192 29-DOF reference \u2192 sparse keyframes",
    "converted_at": "2026-04-13T11:02:59.675083+00:00"
  }
}